<?xml version="1.0" encoding="utf-8"?>
<!--
DDS Security permissions XML for controller enclave
-->
<dds xmlns:xsi="http://www.w3.org/2001/XMLSchema-instance"
     xsi:noNamespaceSchemaLocation="http://www.omg.org/spec/DDS-SECURITY/20170901/omg_shared_ca_permissions.xsd">
  <permissions>
    <grant name="/ubuntu_tank/controller">
      <subject_name>CN=/ubuntu_tank/controller</subject_name>
      <validity>
        <not_before>2026-01-01T00:00:00</not_before>
        <not_after>2036-01-01T00:00:00</not_after>
      </validity>
      <allow_rule>
        <domains>
          <id>0</id>
        </domains>
        <publish>
          <topics>
            <topic>ros_discovery_info</topic>
            <topic>rt/ubuntu_tank_safety/motor_input</topic>
            <topic>rt/odom_raw</topic>
            <topic>rt/rosout</topic>
            <topic>rt/parameter_events</topic>
            <topic>rr/controller/*Reply</topic>
          </topics>
        </publish>
        <subscribe>
          <topics>
            <topic>ros_discovery_info</topic>
            <topic>rt/controller/cmd_vel</topic>
            <topic>rt/parameter_events</topic>
            <topic>rq/controller/*Request</topic>
          </topics>
        </subscribe>
      </allow_rule>
      <default>DENY</default>
    </grant>
  </permissions>
</dds>
